citekey,title,toolname,year,venue,artifact_type,primary_stage,primary_label,QAC1,QAC2,QAC3,QAC4,QAC5,QAC_total,secondary_labels,technique_tags,layer_tag,vuln_type,coding_basis,evidence_source,evidence_span,evidence_charspan,matched_cue,rule_id,notes,QAC_total_3,qac_basis,needs_manual_qac_review,qc_primary_single,qc_evidence_nonempty,qc_secondary_delimiter_ok,needs_abstract_review,needs_labelset_validation,tax_level1,tax_level2,tax_level3,tax_level4,tax_level5,tax_path_full,tax_alt_paths,tax_source,QAC_pass_total_ge4,QAC_threshold
wu2022enhancing,Enhancing security patch identification by capturing structures in commits,E-SPI,2022,IEEE Transactions on Dependable and Secure Computing,study,unclear,unclear,0,1,1,1,1,4,,,,,title-only,title,Enhancing security patch identification by capturing structures in commits,title:19-24,patch; commit,R3,Title-only evidence insufficient for stage; keep as unclear.,1,title-only,TRUE,TRUE,TRUE,TRUE,TRUE,TRUE,Fix Identification,Commit-level identification,,,,Fix Identification > Commit-level identification,,taxonomy_figure,TRUE,4
wu2022vulcnn,Vulcnn: An image-inspired scalable vulnerability detection system,VulCNN,2022,Proceedings of the 44th International Conference on Software Engineering,method/tool,VM.VD,VM.VD.GVD,1,1,1,1,1,5,,,,,title-only,title,Vulcnn: An image-inspired scalable vulnerability detection system,,,,,1,title-only,TRUE,TRUE,TRUE,TRUE,FALSE,TRUE,Vulnerability Detection,General Vulnerability Detection,Static approach,Learning-based,Graph representation,Vulnerability Detection > General Vulnerability Detection > Static approach > Learning-based > Graph representation,,taxonomy_figure,TRUE,4
xu2022tracking,Tracking patches for open source software vulnerabilities,DD (manual curated),2022,Proceedings of the 30th ACM Joint European Software Engineering Conference and Symposium on the Foundations of Software Engineering,study,unclear,unclear,1,1,1,1,1,5,,,,,title-only,title,Tracking patches for open source software vulnerabilities,title:9-14,patch,R3,Title-only evidence insufficient for stage; keep as unclear.,1,title-only,TRUE,TRUE,TRUE,TRUE,TRUE,TRUE,unclear,,,,,,,primary_stage_only,TRUE,4
yang2022cross,"Cross miniapp request forgery: Root causes, attacks, and vulnerability detection",CmrfScanner,2022,Proceedings of the 2022 ACM SIGSAC Conference on Computer and Communications Security,study,VM.VD,VM.VD.LSVD.SYS,1,1,1,0,1,4,,,Application,,title-only,title,"Cross miniapp request forgery: Root causes, attacks, and vulnerability detection",,,,,1,title-only,TRUE,TRUE,TRUE,TRUE,FALSE,TRUE,Vulnerability Detection,Layer-specific Vulnerability Detection,Application layer,Web-facing vulnerabilities,,Vulnerability Detection > Layer-specific Vulnerability Detection > Application layer > Web-facing vulnerabilities,,taxonomy_figure,TRUE,4
yi2022blockscope,BlockScope: Detecting and investigating propagated vulnerabilities in forked blockchain projects,BlockScope,2022,arXiv preprint arXiv:2208.00205,study,VM.VR,VM.VR.PP,1,1,1,1,1,5,VM.VD,GNN,,,title-only,title,BlockScope: Detecting and investigating propagated vulnerabilities in forked blockchain projects,title:40-48,propagat; gat,R1,"Multiple stage cues in title: VM.VR, VM.VD; primary chosen by heuristic.",3,title-only,TRUE,TRUE,TRUE,TRUE,FALSE,TRUE,Vulnerability Detection,Vulnerability Detection for Smart Contracts,Specific vulnerability types,,,Vulnerability Detection > Vulnerability Detection for Smart Contracts > Specific vulnerability types,,taxonomy_figure,TRUE,4
zhang2022example,Example-based vulnerability detection and repair in java code,Seader,2022,Proceedings of the 30th IEEE/ACM International Conference on Program Comprehension,study,VM.VR,VM.VR,0,1,1,1,1,4,VM.VD,,Middleware,,title-only,title,Example-based vulnerability detection and repair in java code,title:42-48,repair,R1,"Multiple stage cues in title: VM.VR, VM.VD; primary chosen by heuristic.",1,title-only,TRUE,TRUE,TRUE,TRUE,FALSE,TRUE,Vulnerability Detection,Layer-specific Vulnerability Detection,Application layer,Ecosystem-specific vulnerabilities,,Vulnerability Detection > Layer-specific Vulnerability Detection > Application layer > Ecosystem-specific vulnerabilities,,taxonomy_figure,TRUE,4
zhang2022reentrancy,Reentrancy vulnerability detection and localization: A deep learning based two-phase approach,ReVulDL,2022,Proceedings of the 37th IEEE/ACM international conference on automated software engineering,method/tool,VM.VD,VM.VD.GVD,1,1,1,1,0,4,,,,Reentrancy,title-only,title,Reentrancy vulnerability detection and localization: A deep learning based two-phase approach,,,,,2,title-only,TRUE,TRUE,TRUE,TRUE,FALSE,TRUE,Vulnerability Detection,Vulnerability Detection for Smart Contracts,Specific vulnerability types,,,Vulnerability Detection > Vulnerability Detection for Smart Contracts > Specific vulnerability types,,taxonomy_figure,TRUE,4
zou2022mvulpreter,mvulpreter: A multi-granularity vulnerability detection system with interpretations,mVulPreter,2022,IEEE Transactions on Dependable and Secure Computing,method/tool,VM.VD,VM.VD.GVD,1,1,1,1,1,5,VM.VA,,,,title-only,title,mvulpreter: A multi-granularity vulnerability detection system with interpretations,title:68-77,interpret,R2,"Multiple stage cues in title: VM.VA, VM.VD; primary chosen by heuristic.",1,title-only,TRUE,TRUE,TRUE,TRUE,FALSE,TRUE,Vulnerability Detection,General Vulnerability Detection,Static approach,Learning-based,Graph representation,Vulnerability Detection > General Vulnerability Detection > Static approach > Learning-based > Graph representation,,taxonomy_figure,TRUE,4
1Trickel_2023,Toss a Fault to Your Witcher: Applying Grey-box Coverage-Guided Mutational Fuzzing to Detect SQL and Command Injection Vulnerabilities,Witcher,2023,2023 IEEE Symposium on Security and Privacy (SP),dataset/benchmark,,,1,1,1,1,0,4,,,,,resource,title,Toss a Fault to Your Witcher: Applying Grey-box Coverage-Guided Mutational Fuzzing to Detect SQL and Command Injection Vulnerabilities,,,,Dataset/benchmark resource; excluded from VM-stage assignment in taxonomy coding.,6,title-only,TRUE,TRUE,TRUE,TRUE,FALSE,FALSE,Vulnerability Detection,Layer-specific Vulnerability Detection,Application layer,Web-facing vulnerabilities,,Vulnerability Detection > Layer-specific Vulnerability Detection > Application layer > Web-facing vulnerabilities,,taxonomy_figure,TRUE,4
CR2023,Compatible Remediation on Vulnerabilities from Third-Party Libraries for Java Projects,CORAL,2023,Proceedings of the 45th International Conference on Software Engineering,study,unclear,unclear,0,1,1,1,1,4,,,Middleware,,title-only,title,Compatible Remediation on Vulnerabilities from Third-Party Libraries for Java Projects,,,R3,Title-only evidence insufficient for stage; keep as unclear.,0,title-only,TRUE,TRUE,TRUE,TRUE,TRUE,TRUE,Vulnerability Repair,Patch propagation,,,,Vulnerability Repair > Patch propagation,,taxonomy_figure,TRUE,4
CoLeFunDa_2023,CoLeFunDa: Explainable Silent Vulnerability Fix Identification,CoLeFunDa,2023,2023 IEEE/ACM 45th International Conference on Software Engineering (ICSE),study,VM.FI,VM.FI.SF,1,0,1,1,1,4,VM.VA;VM.VD,,,,title-only,title,CoLeFunDa: Explainable Silent Vulnerability Fix Identification,title:44-62,fix identification; explain; explainable,R2,"Multiple stage cues in title: VM.FI, VM.VA, VM.VD; primary chosen by heuristic.",1,title-only,TRUE,TRUE,TRUE,TRUE,FALSE,TRUE,Fix Identification,Silent fix identification,,,,Fix Identification > Silent fix identification,,taxonomy_figure,TRUE,4
Davide_2023,Automated Black-Box Testing of Mass Assignment Vulnerabilities in RESTful APIs,ABT,2023,Proceedings of the 45th International Conference on Software Engineering,study,unclear,unclear,1,1,1,1,1,5,,,Application,,title-only,title,Automated Black-Box Testing of Mass Assignment Vulnerabilities in RESTful APIs,,,R3,Title-only evidence insufficient for stage; keep as unclear.,0,title-only,TRUE,TRUE,TRUE,TRUE,TRUE,TRUE,Vulnerability Detection,Layer-specific Vulnerability Detection,Application layer,API and logic vulnerabilities,,Vulnerability Detection > Layer-specific Vulnerability Detection > Application layer > API and logic vulnerabilities,,taxonomy_figure,TRUE,4
Deng_2023,NAUTILUS: automated RESTful API vulnerability detection,NAUTILUS,2023,Proceedings of the 32nd USENIX Conference on Security Symposium,study,VM.VD,VM.VD.LSVD.APP.API,1,0,1,1,1,4,,,Application,,title-only,title,NAUTILUS: automated RESTful API vulnerability detection,,,,,1,title-only,TRUE,TRUE,TRUE,TRUE,FALSE,TRUE,Vulnerability Detection,Layer-specific Vulnerability Detection,Application layer,API and logic vulnerabilities,,Vulnerability Detection > Layer-specific Vulnerability Detection > Application layer > API and logic vulnerabilities,,taxonomy_figure,TRUE,4
Kasser_2023,WHIP: improving static vulnerability detection in web application by forcing tools to collaborate,WHIP,2023,Proceedings of the 32nd USENIX Conference on Security Symposium,method/tool,VM.VD,VM.VD.LSVD.APP.WEB,0,1,1,1,1,4,,Static analysis,Application,,title-only,title,WHIP: improving static vulnerability detection in web application by forcing tools to collaborate,,,,,1,title-only,TRUE,TRUE,TRUE,TRUE,FALSE,TRUE,Vulnerability Detection,Layer-specific Vulnerability Detection,Application layer,Web-facing vulnerabilities,,Vulnerability Detection > Layer-specific Vulnerability Detection > Application layer > Web-facing vulnerabilities,,taxonomy_figure,TRUE,4
MiDas_2023,Multi-Granularity Detector for Vulnerability Fixes,MiDas,2023,IEEE Transactions on Software Engineering,study,VM.VD,VM.VD.GVD,1,1,1,1,1,5,,,,,title-only,title,Multi-Granularity Detector for Vulnerability Fixes,,,,,1,title-only,TRUE,TRUE,TRUE,TRUE,FALSE,TRUE,Fix Identification,Multi-granularity identification,,,,Fix Identification > Multi-granularity identification,,taxonomy_figure,TRUE,4
PatchDiscovery_2023,PatchDiscovery: Patch Presence Test for Identifying Binary Vulnerabilities Based on Key Basic Blocks,PatchDiscovery,2023,IEEE Transactions on Software Engineering,study,VM.FI,VM.FI,1,1,1,1,1,5,,,System,,title-only,title,PatchDiscovery: Patch Presence Test for Identifying Binary Vulnerabilities Based on Key Basic Blocks,title:16-30,patch presence; patch,,,1,title-only,TRUE,TRUE,TRUE,TRUE,FALSE,TRUE,Fix Identification,Patch Finding,,,,Fix Identification > Patch Finding,,taxonomy_figure,TRUE,4
Plumber_2023,Plumber: Boosting the Propagation of Vulnerability Fixes in the npm Ecosystem,Plumber,2023,IEEE Transactions on Software Engineering,method/tool,VM.VR,VM.VR.PP,1,1,1,0,1,4,VM.VD,GNN,System,,title-only,title,Plumber: Boosting the Propagation of Vulnerability Fixes in the npm Ecosystem,title:22-30,propagat; gat,R1,"Multiple stage cues in title: VM.VR, VM.VD; primary chosen by heuristic.",3,title-only,TRUE,TRUE,TRUE,TRUE,FALSE,TRUE,Vulnerability Repair,Patch propagation,,,,Vulnerability Repair > Patch propagation,,taxonomy_figure,TRUE,4
TANG2023CSGVD,CSGVD: A deep learning approach combining sequence and graph embedding for source code vulnerability detection,CSGVD,2023,Journal of Systems and Software,method/tool,VM.VD,VM.VD.GVD.S.LB.GRAPH,1,1,1,1,1,5,,Program graphs; Token encoder,,,title-only,title,CSGVD: A deep learning approach combining sequence and graph embedding for source code vulnerability detection,,,,,2,title-only,TRUE,TRUE,TRUE,TRUE,FALSE,TRUE,Vulnerability Detection,General Vulnerability Detection,Static approach,Learning-based,Graph representation,Vulnerability Detection > General Vulnerability Detection > Static approach > Learning-based > Graph representation,,taxonomy_figure,TRUE,4
al_2023,SQIRL: Grey-box detection of SQL injection vulnerabilities using reinforcement learning,SQIRL,2023,Proceedings of the 32nd USENIX Conference on Security Symposium,dataset/benchmark,,,1,1,1,1,0,4,,,,,resource,title,SQIRL: Grey-box detection of SQL injection vulnerabilities using reinforcement learning,,,,Dataset/benchmark resource; excluded from VM-stage assignment in taxonomy coding.,5,title-only,TRUE,TRUE,TRUE,TRUE,FALSE,FALSE,Vulnerability Detection,Layer-specific Vulnerability Detection,Application layer,Web-facing vulnerabilities,,Vulnerability Detection > Layer-specific Vulnerability Detection > Application layer > Web-facing vulnerabilities,,taxonomy_figure,TRUE,4
amusuo2023systematically,Systematically detecting packet validation vulnerabilities in embedded network stacks,EmNetTest,2023,2023 38th IEEE/ACM International Conference on Automated Software Engineering (ASE),method/tool,VM.VD,VM.VD.LSVD.NET.IMPL,1,1,1,0,1,4,,,Network,,title-only,title,Systematically detecting packet validation vulnerabilities in embedded network stacks,,,,,1,title-only,TRUE,TRUE,TRUE,TRUE,FALSE,TRUE,Vulnerability Detection,Layer-specific Vulnerability Detection,Network layer,Network implementation vulnerabilities,,Vulnerability Detection > Layer-specific Vulnerability Detection > Network layer > Network implementation vulnerabilities,,taxonomy_figure,TRUE,4
cao2023learning,Learning to detect memory-related vulnerabilities,MVD+,2023,ACM Transactions on Software Engineering and Methodology,study,VM.VD,VM.VD.LSVD.SYS,1,1,1,1,1,5,,,System,,title-only,title,Learning to detect memory-related vulnerabilities,,,,,2,title-only,TRUE,TRUE,TRUE,TRUE,FALSE,TRUE,Vulnerability Detection,Layer-specific Vulnerability Detection,Application layer,Memory-related vulnerabilities,,Vulnerability Detection > Layer-specific Vulnerability Detection > Application layer > Memory-related vulnerabilities,,taxonomy_figure,TRUE,4
cao2023oddfuzz,Oddfuzz: Discovering java deserialization vulnerabilities via structure-aware directed greybox fuzzing,ODDFUZZ,2023,2023 IEEE Symposium on Security and Privacy (SP),study,unclear,unclear,1,1,1,1,1,5,,Fuzzing,Middleware,,title-only,title,Oddfuzz: Discovering java deserialization vulnerabilities via structure-aware directed greybox fuzzing,title:3-7,fuzz; fuzzing; greybox,R3,Title-only evidence insufficient for stage; keep as unclear.,3,title-only,TRUE,TRUE,TRUE,TRUE,TRUE,TRUE,Vulnerability Detection,Layer-specific Vulnerability Detection,Application layer,API and logic vulnerabilities,,Vulnerability Detection > Layer-specific Vulnerability Detection > Application layer > API and logic vulnerabilities,Vulnerability Detection > Layer-specific Vulnerability Detection > Application layer > Ecosystem-specific vulnerabilities,taxonomy_figure,TRUE,4
christou2023ivysyn,$\{$IvySyn$\}$: Automated vulnerability discovery in deep learning frameworks,IvySyn,2023,32nd USENIX Security Symposium (USENIX Security 23),method/tool,VM.VD,VM.VD.LSVD.MW.DL,1,1,1,1,0,4,,,Middleware,,title-only,title,$\{$IvySyn$\}$: Automated vulnerability discovery in deep learning frameworks,,,,,1,title-only,TRUE,TRUE,TRUE,TRUE,FALSE,TRUE,Vulnerability Detection,Layer-specific Vulnerability Detection,Middleware layer,Deep learning frameworks,,Vulnerability Detection > Layer-specific Vulnerability Detection > Middleware layer > Deep learning frameworks,,taxonomy_figure,TRUE,4
defihacklabs2023,DeFi Hacks Reproduce - Foundry,DeFiHackLabs,2023,\url{https://github.com/SunWeb3Sec/DeFiHackLabs},study,unclear,unclear,0,1,1,1,1,4,,,Smart contract,,title-only,title,DeFi Hacks Reproduce - Foundry,title:0-4,defi,R3,Title-only evidence insufficient for stage; keep as unclear.,0,title-only,TRUE,TRUE,TRUE,TRUE,TRUE,TRUE,unclear,,,,,,,primary_stage_only,TRUE,4
deng2023differential,Differential testing of cross deep learning framework $\{$APIs$\}$: Revealing inconsistencies and vulnerabilities,TENSORSCOPE,2023,32nd USENIX Security Symposium (USENIX Security 23),method/tool,unclear,unclear,0,1,1,1,1,4,,,Application,,title-only,title,Differential testing of cross deep learning framework $\{$APIs$\}$: Revealing inconsistencies and vulnerabilities,,,R3,Title-only evidence insufficient for stage; keep as unclear.,1,title-only,TRUE,TRUE,TRUE,TRUE,TRUE,TRUE,Vulnerability Detection,Layer-specific Vulnerability Detection,Middleware layer,Deep learning frameworks,,Vulnerability Detection > Layer-specific Vulnerability Detection > Middleware layer > Deep learning frameworks,,taxonomy_figure,TRUE,4
dunlap2023finding,Finding fixed vulnerabilities with off-the-shelf static analysis,DAA,2023,2023 IEEE 8th European Symposium on Security and Privacy (EuroS&P),study,VM.VD,VM.VD.GVD,1,1,1,1,1,5,,Static analysis,,,title-only,title,Finding fixed vulnerabilities with off-the-shelf static analysis,,,,,2,title-only,TRUE,TRUE,TRUE,TRUE,FALSE,TRUE,Fix Identification,Silent fix identification,,,,Fix Identification > Silent fix identification,,taxonomy_figure,TRUE,4
fu2023vulexplainer,Vulexplainer: A transformer-based hierarchical distillation for explaining vulnerability types,VulExplainer,2023,IEEE Transactions on Software Engineering,study,VM.VD,VM.VD.GVD.S.LB.SEQ,1,1,1,1,0,4,VM.VA,Token encoder,,,title-only,title,Vulexplainer: A transformer-based hierarchical distillation for explaining vulnerability types,title:3-10,explain,R2,"Multiple stage cues in title: VM.VA, VM.VD; primary chosen by heuristic.",3,title-only,TRUE,TRUE,TRUE,TRUE,FALSE,TRUE,Vulnerability Analysis,Classification and Interpretation,,,,Vulnerability Analysis > Classification and Interpretation,,taxonomy_figure,TRUE,4
ghaleb2023achecker,Achecker: Statically detecting smart contract access control vulnerabilities,AChecker,2023,2023 IEEE/ACM 45th International Conference on Software Engineering (ICSE),study,VM.VD,VM.VD.SC.S,1,1,1,1,1,5,,Static analysis,Smart contract,,title-only,title,Achecker: Statically detecting smart contract access control vulnerabilities,title:31-45,smart contract,,,1,title-only,TRUE,TRUE,TRUE,TRUE,FALSE,TRUE,Vulnerability Detection,Vulnerability Detection for Smart Contracts,Specific vulnerability types,,,Vulnerability Detection > Vulnerability Detection for Smart Contracts > Specific vulnerability types,,taxonomy_figure,TRUE,4
gritti2023confusum,Confusum contractum: Confused deputy vulnerabilities in ethereum smart contracts,Confusum Contractum,2023,32nd USENIX Security Symposium (USENIX Security 23),study,unclear,unclear,0,1,1,1,1,4,,,Smart contract,,title-only,title,Confusum contractum: Confused deputy vulnerabilities in ethereum smart contracts,title:65-79,smart contract; ethereum,R3,Title-only evidence insufficient for stage; keep as unclear.,0,title-only,TRUE,TRUE,TRUE,TRUE,TRUE,TRUE,Vulnerability Detection,Vulnerability Detection for Smart Contracts,Specific vulnerability types,,,Vulnerability Detection > Vulnerability Detection for Smart Contracts > Specific vulnerability types,,taxonomy_figure,TRUE,4
gross2023fuzzilli,FUZZILLI: Fuzzing for JavaScript JIT Compiler Vulnerabilities.,FUZZILLI,2023,NDSS,study,unclear,unclear,0,1,1,1,1,4,,Fuzzing,Middleware,,title-only,title,FUZZILLI: Fuzzing for JavaScript JIT Compiler Vulnerabilities.,title:0-4,fuzz; fuzzing,R3,Title-only evidence insufficient for stage; keep as unclear.,3,title-only,TRUE,TRUE,TRUE,TRUE,TRUE,TRUE,Vulnerability Detection,Layer-specific Vulnerability Detection,System layer,Binary code & compiler vulnerabilities,,Vulnerability Detection > Layer-specific Vulnerability Detection > System layer > Binary code & compiler vulnerabilities,,taxonomy_figure,TRUE,4
kang2023scaling,Scaling javascript abstract interpretation to detect and exploit node. js taint-style vulnerability,FAST,2023,2023 IEEE Symposium on Security and Privacy (SP),study,VM.VD,VM.VD.LSVD.MW.JAVA,1,0,1,1,1,4,VM.VA,Taint analysis,Middleware,,title-only,title,Scaling javascript abstract interpretation to detect and exploit node. js taint-style vulnerability,title:28-37,interpret,R2,"Multiple stage cues in title: VM.VA, VM.VD; primary chosen by heuristic.",3,title-only,TRUE,TRUE,TRUE,TRUE,FALSE,TRUE,Vulnerability Detection,Layer-specific Vulnerability Detection,Application layer,Ecosystem-specific vulnerabilities,,Vulnerability Detection > Layer-specific Vulnerability Detection > Application layer > Ecosystem-specific vulnerabilities,,taxonomy_figure,TRUE,4
kong2023defitainter,Defitainter: Detecting price manipulation vulnerabilities in defi protocols,DeFiTainter,2023,Proceedings of the 32nd ACM SIGSOFT International Symposium on Software Testing and Analysis,study,VM.VD,VM.VD.SC.S,1,1,1,1,0,4,,Taint analysis,Smart contract,,title-only,title,Defitainter: Detecting price manipulation vulnerabilities in defi protocols,title:0-4,defi,,,3,title-only,TRUE,TRUE,TRUE,TRUE,FALSE,TRUE,Vulnerability Detection,Vulnerability Detection for Smart Contracts,Specific vulnerability types,,,Vulnerability Detection > Vulnerability Detection for Smart Contracts > Specific vulnerability types,,taxonomy_figure,TRUE,4
liao2023smartstate,Smartstate: Detecting state-reverting vulnerabilities in smart contracts via fine-grained state-dependency analysis,SmartState,2023,Proceedings of the 32nd ACM SIGSOFT International Symposium on Software Testing and Analysis,study,VM.VD,VM.VD.SC.S,1,1,1,1,1,5,VM.VA,,Smart contract,,title-only,title,Smartstate: Detecting state-reverting vulnerabilities in smart contracts via fine-grained state-dependency analysis,title:57-71,smart contract,R2,"Multiple stage cues in title: VM.VA, VM.VD; primary chosen by heuristic.",1,title-only,TRUE,TRUE,TRUE,TRUE,FALSE,TRUE,Vulnerability Detection,Vulnerability Detection for Smart Contracts,Specific vulnerability types,,,Vulnerability Detection > Vulnerability Detection for Smart Contracts > Specific vulnerability types,,taxonomy_figure,TRUE,4
liu2023demystifying,Demystifying rce vulnerabilities in llm-integrated apps. arXiv 2023,LLMSmith,2023,arXiv preprint arXiv:2309.02926,study,unclear,unclear,1,1,1,1,0,4,,LLM,,,title-only,title,Demystifying rce vulnerabilities in llm-integrated apps. arXiv 2023,title:36-39,llm,R3,Title-only evidence insufficient for stage; keep as unclear.,2,title-only,TRUE,TRUE,TRUE,TRUE,TRUE,TRUE,Vulnerability Detection,Layer-specific Vulnerability Detection,Application layer,API and logic vulnerabilities,,Vulnerability Detection > Layer-specific Vulnerability Detection > Application layer > API and logic vulnerabilities,,taxonomy_figure,TRUE,4
luo2023vulhawk,VulHawk: Cross-architecture vulnerability detection with entropy-based binary code search.,VulHawk,2023,NDSS,study,VM.VD,VM.VD.LSVD.SYS.BIN,1,1,1,1,1,5,,,System,,title-only,title,VulHawk: Cross-architecture vulnerability detection with entropy-based binary code search.,,,,,1,title-only,TRUE,TRUE,TRUE,TRUE,FALSE,TRUE,Vulnerability Detection,Layer-specific Vulnerability Detection,Application layer,Cross-scope and recurring vulnerabilities,,Vulnerability Detection > Layer-specific Vulnerability Detection > Application layer > Cross-scope and recurring vulnerabilities,,taxonomy_figure,TRUE,4
lyu2023chronos,Chronos: Time-aware zero-shot identification of libraries from vulnerability reports,CHRONOS,2023,2023 IEEE/ACM 45th International Conference on Software Engineering (ICSE),study,VM.VD,VM.VD.LSVD.SYS,1,1,1,1,0,4,VM.VA,,System,,title-only,title,Chronos: Time-aware zero-shot identification of libraries from vulnerability reports,,,R2,"Multiple stage cues in title: VM.VA, VM.VD; primary chosen by heuristic.",1,title-only,TRUE,TRUE,TRUE,TRUE,FALSE,TRUE,Vulnerability Analysis,Artifact Analysis,,,,Vulnerability Analysis > Artifact Analysis,,taxonomy_figure,TRUE,4
mirsky2023vulchecker,$\{$VulChecker$\}$: Graph-based vulnerability localization in source code,VulChecker,2023,32nd USENIX Security Symposium (USENIX Security 23),study,VM.VD,VM.VD.GVD.S.GA,1,1,0,1,1,4,,Program graphs,,,title-only,title,$\{$VulChecker$\}$: Graph-based vulnerability localization in source code,,,,,1,title-only,TRUE,TRUE,TRUE,TRUE,FALSE,TRUE,Vulnerability Detection,General Vulnerability Detection,Static approach,Learning-based,Graph representation,Vulnerability Detection > General Vulnerability Detection > Static approach > Learning-based > Graph representation,,taxonomy_figure,TRUE,4
ni2023fva,Fva: Assessing function-level vulnerability by integrating flow-sensitive structure and code statement semantic,FVA; FVA function-level set,2023,2023 IEEE/ACM 31st International Conference on Program Comprehension (ICPC),study,VM.VD,VM.VD.GVD,1,1,1,1,1,5,,,,,title-only,title,Fva: Assessing function-level vulnerability by integrating flow-sensitive structure and code statement semantic,,,,,0,title-only,TRUE,TRUE,TRUE,TRUE,FALSE,TRUE,Vulnerability Analysis,Assessment and Prioritization,,,,Vulnerability Analysis > Assessment and Prioritization,,taxonomy_figure,TRUE,4
pan2023fine,Fine-grained commit-level vulnerability type prediction by CWE tree structure,TREEVUL; SRC (commit-level CWE),2023,2023 IEEE/ACM 45th International Conference on Software Engineering (ICSE),study,VM.FI,VM.FI,1,0,1,1,1,4,VM.VD,,,,title-only,title,Fine-grained commit-level vulnerability type prediction by CWE tree structure,title:13-25,commit-level; commit,R1,"Multiple stage cues in title: VM.FI, VM.VD; primary chosen by heuristic.",0,title-only,TRUE,TRUE,TRUE,TRUE,FALSE,TRUE,Vulnerability Analysis,Classification and Interpretation,,,,Vulnerability Analysis > Classification and Interpretation,,taxonomy_figure,TRUE,4
qian2023cross,Cross-Modality Mutual Learning for Enhancing Smart Contract Vulnerability Detection on Bytecode,EST,2023,Proceedings of the ACM Web Conference,study,VM.VD,VM.VD.SC.S,1,1,1,1,1,5,,,Smart contract,,title-only,title,Cross-Modality Mutual Learning for Enhancing Smart Contract Vulnerability Detection on Bytecode,title:45-59,smart contract,,,2,title-only,TRUE,TRUE,TRUE,TRUE,FALSE,TRUE,Vulnerability Detection,Vulnerability Detection for Smart Contracts,Static approach,,,Vulnerability Detection > Vulnerability Detection for Smart Contracts > Static approach,,primary_label_code,TRUE,4
