citekey,title,toolname,year,venue,artifact_type,primary_stage,primary_label,QAC1,QAC2,QAC3,QAC4,QAC5,QAC_total,secondary_labels,technique_tags,layer_tag,vuln_type,coding_basis,evidence_source,evidence_span,evidence_charspan,matched_cue,rule_id,notes,QAC_total_3,qac_basis,needs_manual_qac_review,qc_primary_single,qc_evidence_nonempty,qc_secondary_delimiter_ok,needs_abstract_review,needs_labelset_validation,tax_level1,tax_level2,tax_level3,tax_level4,tax_level5,tax_path_full,tax_alt_paths,tax_source,QAC_pass_total_ge4,QAC_threshold
qian2023demystifying,"Demystifying random number in ethereum smart contract: Taxonomy, vulnerability identification, and attack detection",RNVulDet,2023,IEEE Transactions on Software Engineering,study,VM.VD,VM.VD.SC.S,1,1,1,1,1,5,,,Smart contract,,title-only,title,"Demystifying random number in ethereum smart contract: Taxonomy, vulnerability identification, and attack detection",title:39-53,smart contract; ethereum,,,1,title-only,TRUE,TRUE,TRUE,TRUE,FALSE,TRUE,Vulnerability Detection,Vulnerability Detection for Smart Contracts,Dynamic approach,,,Vulnerability Detection > Vulnerability Detection for Smart Contracts > Dynamic approach,,taxonomy_figure,TRUE,4
sendner2023smarter,Smarter Contracts: Detecting Vulnerabilities in Smart Contracts with Deep Transfer Learning.,ESCORT,2023,NDSS,study,VM.VD,VM.VD.SC.S,1,1,1,0,1,4,,,Smart contract,,title-only,title,Smarter Contracts: Detecting Vulnerabilities in Smart Contracts with Deep Transfer Learning.,title:48-62,smart contract,,,2,title-only,TRUE,TRUE,TRUE,TRUE,FALSE,TRUE,Vulnerability Detection,Vulnerability Detection for Smart Contracts,Static approach,,,Vulnerability Detection > Vulnerability Detection for Smart Contracts > Static approach,,taxonomy_figure,TRUE,4
song2023pkvic,PKVIC: Supplement missing software package information in security vulnerability reports,PKVIC,2023,IEEE Transactions on Dependable and Secure Computing,study,VM.VD,VM.VD.GVD,0,1,1,1,1,4,VM.VA,,,,title-only,title,PKVIC: Supplement missing software package information in security vulnerability reports,,,R2,"Multiple stage cues in title: VM.VA, VM.VD; primary chosen by heuristic.",0,title-only,TRUE,TRUE,TRUE,TRUE,FALSE,TRUE,Vulnerability Analysis,Artifact Analysis,,,,Vulnerability Analysis > Artifact Analysis,,taxonomy_figure,TRUE,4
su2023defiwarder,Defiwarder: Protecting defi apps from token leaking vulnerabilities,DeFiWarder,2023,2023 38th IEEE/ACM International Conference on Automated Software Engineering (ASE),study,unclear,unclear,1,1,1,1,1,5,,Token encoder,Smart contract,,title-only,title,Defiwarder: Protecting defi apps from token leaking vulnerabilities,title:0-4,defi,R3,Title-only evidence insufficient for stage; keep as unclear.,0,title-only,TRUE,TRUE,TRUE,TRUE,TRUE,TRUE,Vulnerability Detection,Vulnerability Detection for Smart Contracts,Specific vulnerability types,,,Vulnerability Detection > Vulnerability Detection for Smart Contracts > Specific vulnerability types,,taxonomy_figure,TRUE,4
van2023scripted,Scripted Henchmen: Leveraging XS-Leaks for Cross-Site Vulnerability Detection,Scripted Henchmen,2023,2023 IEEE Security and Privacy Workshops \(SPW\),study,VM.VD,VM.VD.LSVD.SYS,1,1,1,1,0,4,,,System,,title-only,title,Scripted Henchmen: Leveraging XS-Leaks for Cross-Site Vulnerability Detection,,,,,1,title-only,TRUE,TRUE,TRUE,TRUE,FALSE,TRUE,Vulnerability Detection,Layer-specific Vulnerability Detection,Application layer,XSS vulnerabilities,,Vulnerability Detection > Layer-specific Vulnerability Detection > Application layer > XSS vulnerabilities,Vulnerability Detection > Layer-specific Vulnerability Detection > Application layer > Web-facing vulnerabilities,taxonomy_figure,TRUE,4
vasquez2023most,The most dangerous codec in the world: Finding and exploiting vulnerabilities in h. 264 decoders,H26FORGE,2023,32nd USENIX Security Symposium (USENIX Security 23),study,VM.VD,VM.VD.LSVD.SYS,0,1,1,1,1,4,,,System,,title-only,title,The most dangerous codec in the world: Finding and exploiting vulnerabilities in h. 264 decoders,,,,,0,title-only,TRUE,TRUE,TRUE,TRUE,FALSE,TRUE,Vulnerability Detection,General Vulnerability Detection,Dynamic approach,Fuzzing,,Vulnerability Detection > General Vulnerability Detection > Dynamic approach > Fuzzing,,taxonomy_figure,TRUE,4
wang2023RENGAR,Effective ReDoS Detection by Principled Vulnerability Modeling and Exploit Generation,RENGAR,2023,2023 IEEE Symposium on Security and Privacy (SP),study,VM.VD,VM.VD.LSVD.NET.REDOS,1,1,1,1,0,4,,,Network,ReDoS,title-only,title,Effective ReDoS Detection by Principled Vulnerability Modeling and Exploit Generation,,,,,1,title-only,TRUE,TRUE,TRUE,TRUE,FALSE,TRUE,Vulnerability Detection,Layer-specific Vulnerability Detection,Network layer,ReDoS vulnerabilities,,Vulnerability Detection > Layer-specific Vulnerability Detection > Network layer > ReDoS vulnerabilities,,taxonomy_figure,TRUE,4
wang2023deepvd,Deepvd: Toward class-separation features for neural network vulnerability detection,DeepVD,2023,2023 IEEE/ACM 45th International Conference on Software Engineering (ICSE),study,VM.VD,VM.VD.LSVD.NET.IMPL,1,1,1,1,1,5,,,Network,,title-only,title,Deepvd: Toward class-separation features for neural network vulnerability detection,,,,,2,title-only,TRUE,TRUE,TRUE,TRUE,FALSE,TRUE,Vulnerability Detection,General Vulnerability Detection,Static approach,Learning-based,Graph representation,Vulnerability Detection > General Vulnerability Detection > Static approach > Learning-based > Graph representation,,taxonomy_figure,TRUE,4
wen2023less,When less is enough: Positive and unlabeled learning model for vulnerability detection,PILOT,2023,2023 38th IEEE/ACM International Conference on Automated Software Engineering (ASE),study,VM.VD,VM.VD.LSVD.SYS,0,1,1,1,1,4,,,System,,title-only,title,When less is enough: Positive and unlabeled learning model for vulnerability detection,,,,,2,title-only,TRUE,TRUE,TRUE,TRUE,FALSE,TRUE,Vulnerability Detection,General Vulnerability Detection,Static approach,Learning-based,Sequence representation,Vulnerability Detection > General Vulnerability Detection > Static approach > Learning-based > Sequence representation,,taxonomy_figure,TRUE,4
wen2023meta,Meta-path based attentional graph learning model for vulnerability detection,MAGNET,2023,IEEE Transactions on Software Engineering,study,VM.VD,VM.VD.GVD.S.LB.GRAPH,1,1,0,1,1,4,,Program graphs,,,title-only,title,Meta-path based attentional graph learning model for vulnerability detection,,,,,2,title-only,TRUE,TRUE,TRUE,TRUE,FALSE,TRUE,Vulnerability Detection,General Vulnerability Detection,Static approach,Learning-based,Graph representation,Vulnerability Detection > General Vulnerability Detection > Static approach > Learning-based > Graph representation,,taxonomy_figure,TRUE,4
wen2023vulnerability,Vulnerability detection with graph simplification and enhanced graph representation learning,AMPLE,2023,2023 IEEE/ACM 45th International Conference on Software Engineering (ICSE),study,VM.VD,VM.VD.GVD.S.LB.GRAPH,1,1,1,1,1,5,,Program graphs,,,title-only,title,Vulnerability detection with graph simplification and enhanced graph representation learning,,,,,2,title-only,TRUE,TRUE,TRUE,TRUE,FALSE,TRUE,Vulnerability Detection,General Vulnerability Detection,Static approach,Learning-based,Graph representation,Vulnerability Detection > General Vulnerability Detection > Static approach > Learning-based > Graph representation,,taxonomy_figure,TRUE,4
woo2023v1scan,$\{$V1SCAN$\}$: Discovering 1-day Vulnerabilities in Reused $\{$C/C++$\}$ Open-source Software Components Using Code Classification Techniques,V1SCAN,2023,32nd USENIX Security Symposium (USENIX Security 23),method/tool,VM.VD,VM.VD.GVD,1,1,1,1,0,4,,,,,title-only,title,$\{$V1SCAN$\}$: Discovering 1-day Vulnerabilities in Reused $\{$C/C++$\}$ Open-source Software Components Using Code Classification Techniques,,,,,0,title-only,TRUE,TRUE,TRUE,TRUE,FALSE,TRUE,Vulnerability Detection,Layer-specific Vulnerability Detection,Middleware layer,Third-party components,,Vulnerability Detection > Layer-specific Vulnerability Detection > Middleware layer > Third-party components,,taxonomy_figure,TRUE,4
wu2023learning,Learning program semantics for vulnerability detection via vulnerability-specific inter-procedural slicing,SnapVuln,2023,Proceedings of the 31st ACM Joint European Software Engineering Conference and Symposium on the Foundations of Software Engineering,study,VM.VD,VM.VD.GVD,1,1,1,1,0,4,,,,,title-only,title,Learning program semantics for vulnerability detection via vulnerability-specific inter-procedural slicing,,,,,2,title-only,TRUE,TRUE,TRUE,TRUE,FALSE,TRUE,Vulnerability Detection,General Vulnerability Detection,Static approach,Learning-based,Graph representation,Vulnerability Detection > General Vulnerability Detection > Static approach > Learning-based > Graph representation,,taxonomy_figure,TRUE,4
yin_2023,Scanner++: Enhanced Vulnerability Detection of Web Applications with Attack Intent Synchronization,Scanner++,2023,ACM Trans. Softw. Eng. Methodol.,study,VM.VD,VM.VD.LSVD.APP.WEB,1,1,1,1,0,4,,,Application,,title-only,title,Scanner++: Enhanced Vulnerability Detection of Web Applications with Attack Intent Synchronization,,,,,1,title-only,TRUE,TRUE,TRUE,TRUE,FALSE,TRUE,Vulnerability Detection,Layer-specific Vulnerability Detection,Application layer,Web-facing vulnerabilities,,Vulnerability Detection > Layer-specific Vulnerability Detection > Application layer > Web-facing vulnerabilities,,taxonomy_figure,TRUE,4
yitagesu2023extraction,Extraction of phrase-based concepts in vulnerability descriptions through unsupervised labeling,Yitagesu et al.; TVD/TVDC,2023,ACM Transactions on Software Engineering and Methodology,study,VM.VD,VM.VD.GVD,1,1,1,1,1,5,,,,,title-only,title,Extraction of phrase-based concepts in vulnerability descriptions through unsupervised labeling,,,,,0,title-only,TRUE,TRUE,TRUE,TRUE,FALSE,TRUE,Vulnerability Analysis,Artifact Analysis,,,,Vulnerability Analysis > Artifact Analysis,,taxonomy_figure,TRUE,4
yu2023coco,"CoCo: Efficient browser extension vulnerability detection via coverage-guided, concurrent abstract interpretation",CoCo,2023,Proceedings of the 2023 ACM SIGSAC Conference on Computer and Communications Security,study,VM.VD,VM.VD.GVD.D.FUZZ,1,1,0,1,1,4,VM.VA,Fuzzing,,,title-only,title,"CoCo: Efficient browser extension vulnerability detection via coverage-guided, concurrent abstract interpretation",title:99-108,interpret; coverage-guided,R2,"Multiple stage cues in title: VM.VA, VM.VD; primary chosen by heuristic.",3,title-only,TRUE,TRUE,TRUE,TRUE,FALSE,TRUE,Vulnerability Detection,Layer-specific Vulnerability Detection,Application layer,Ecosystem-specific vulnerabilities,,Vulnerability Detection > Layer-specific Vulnerability Detection > Application layer > Ecosystem-specific vulnerabilities,,taxonomy_figure,TRUE,4
yuan2023cacheql,$\{$CacheQL$\}$: Quantifying and Localizing Cache $\{$Side-Channel$\}$ Vulnerabilities in Production Software,CacheQL,2023,32nd USENIX Security Symposium (USENIX Security 23),study,unclear,unclear,0,1,1,1,1,4,,,,,title-only,title,$\{$CacheQL$\}$: Quantifying and Localizing Cache $\{$Side-Channel$\}$ Vulnerabilities in Production Software,,,R3,Title-only evidence insufficient for stage; keep as unclear.,0,title-only,TRUE,TRUE,TRUE,TRUE,TRUE,TRUE,Vulnerability Detection,General Vulnerability Detection,Dynamic approach,Fuzzing,,Vulnerability Detection > General Vulnerability Detection > Dynamic approach > Fuzzing,,taxonomy_figure,TRUE,4
yuan2023enhancing,Enhancing deep learning-based vulnerability detection by building behavior graph model,VulBG,2023,2023 IEEE/ACM 45th International Conference on Software Engineering (ICSE),study,VM.VD,VM.VD.GVD.S.LB.GRAPH,1,0,1,1,1,4,,Program graphs,,,title-only,title,Enhancing deep learning-based vulnerability detection by building behavior graph model,,,,,2,title-only,TRUE,TRUE,TRUE,TRUE,FALSE,TRUE,Vulnerability Detection,General Vulnerability Detection,Static approach,Learning-based,Graph-to-sequence representation,Vulnerability Detection > General Vulnerability Detection > Static approach > Learning-based > Graph-to-sequence representation,,taxonomy_figure,TRUE,4
zeng2023illation,ILLATION: Improving Vulnerability Risk Prioritization by Learning From Network,ILLATION; ILLATION dataset (NVD+ExploitDB),2023,IEEE Transactions on Dependable and Secure Computing,study,VM.VD,VM.VD.LSVD.NET.IMPL,1,1,1,1,1,5,VM.VA,,Network,,title-only,title,ILLATION: Improving Vulnerability Risk Prioritization by Learning From Network,title:39-46,priorit; risk,R2,"Multiple stage cues in title: VM.VA, VM.VD; primary chosen by heuristic.",2,title-only,TRUE,TRUE,TRUE,TRUE,FALSE,TRUE,Vulnerability Analysis,Assessment and Prioritization,,,,Vulnerability Analysis > Assessment and Prioritization,,taxonomy_figure,TRUE,4
zhang2023cpvd,CPVD: Cross project vulnerability detection based on graph attention network and domain adaptation,CPVD,2023,IEEE Transactions on Software Engineering,study,VM.VD,VM.VD.LSVD.NET.IMPL,1,1,1,1,0,4,,Program graphs,Network,,title-only,title,CPVD: Cross project vulnerability detection based on graph attention network and domain adaptation,,,,,1,title-only,TRUE,TRUE,TRUE,TRUE,FALSE,TRUE,Vulnerability Detection,Layer-specific Vulnerability Detection,Application layer,Cross-scope and recurring vulnerabilities,,Vulnerability Detection > Layer-specific Vulnerability Detection > Application layer > Cross-scope and recurring vulnerabilities,,taxonomy_figure,TRUE,4
zhang2023learning,Learning to locate and describe vulnerabilities,VulTeller,2023,2023 38th IEEE/ACM International Conference on Automated Software Engineering (ASE),study,VM.FI,VM.FI.PF,1,1,1,1,1,5,,,,,title-only,title,Learning to locate and describe vulnerabilities,title:12-18,locate,,,2,title-only,TRUE,TRUE,TRUE,TRUE,FALSE,TRUE,Vulnerability Detection,General Vulnerability Detection,Static approach,Learning-based,Graph-to-sequence representation,Vulnerability Detection > General Vulnerability Detection > Static approach > Learning-based > Graph-to-sequence representation,,taxonomy_figure,TRUE,4
zhang2023vulnerability,Vulnerability detection by learning from syntax-based execution paths of code,EPVD,2023,IEEE Transactions on Software Engineering,study,VM.VD,VM.VD.GVD.D,1,1,1,1,1,5,,Dynamic analysis,,,title-only,title,Vulnerability detection by learning from syntax-based execution paths of code,,,,,2,title-only,TRUE,TRUE,TRUE,TRUE,FALSE,TRUE,Vulnerability Detection,General Vulnerability Detection,Static approach,Learning-based,Graph-to-sequence representation,Vulnerability Detection > General Vulnerability Detection > Static approach > Learning-based > Graph-to-sequence representation,,taxonomy_figure,TRUE,4
zhou2023clfuzz,CLFuzz: Vulnerability detection of cryptographic algorithm implementation via semantic-aware fuzzing,CLFuzz,2023,ACM Transactions on Software Engineering and Methodology,study,VM.VD,VM.VD.GVD.D.FUZZ,1,1,1,1,1,5,,Fuzzing; Program graphs,,,title-only,title,CLFuzz: Vulnerability detection of cryptographic algorithm implementation via semantic-aware fuzzing,title:2-6,fuzz; fuzzing,,,3,title-only,TRUE,TRUE,TRUE,TRUE,FALSE,TRUE,Vulnerability Detection,Layer-specific Vulnerability Detection,Middleware layer,Third-party components,,Vulnerability Detection > Layer-specific Vulnerability Detection > Middleware layer > Third-party components,,taxonomy_figure,TRUE,4
Du_2024,Vulnerability-oriented testing for RESTful APIs,VOAPI$^2$,2024,Proceedings of the 33rd USENIX Conference on Security Symposium,study,VM.VD,VM.VD.LSVD.APP.API,1,1,0,1,1,4,,,Application,,title-only,title,Vulnerability-oriented testing for RESTful APIs,,,,,0,title-only,TRUE,TRUE,TRUE,TRUE,FALSE,TRUE,Vulnerability Detection,Layer-specific Vulnerability Detection,Application layer,API and logic vulnerabilities,,Vulnerability Detection > Layer-specific Vulnerability Detection > Application layer > API and logic vulnerabilities,,taxonomy_figure,TRUE,4
EarlyVulnFix_2024,Silent Taint-Style Vulnerability Fixes Identification,EarlyVulnFix,2024,Proceedings of the 33rd ACM SIGSOFT International Symposium on Software Testing and Analysis,study,VM.VD,VM.VD.GVD,1,1,0,1,1,4,,Taint analysis,,,title-only,title,Silent Taint-Style Vulnerability Fixes Identification,,,,,3,title-only,TRUE,TRUE,TRUE,TRUE,FALSE,TRUE,Fix Identification,Silent fix identification,,,,Fix Identification > Silent fix identification,,taxonomy_figure,TRUE,4
Emre_2024_Atropos,Atropos: effective fuzzing of web applications for server-side vulnerabilities,ATROPOS,2024,Proceedings of the 33rd USENIX Conference on Security Symposium,study,unclear,unclear,0,1,1,1,1,4,,Fuzzing,Application,,title-only,title,Atropos: effective fuzzing of web applications for server-side vulnerabilities,title:19-23,fuzz; fuzzing,R3,Title-only evidence insufficient for stage; keep as unclear.,3,title-only,TRUE,TRUE,TRUE,TRUE,TRUE,TRUE,Vulnerability Detection,Layer-specific Vulnerability Detection,Application layer,Web-facing vulnerabilities,,Vulnerability Detection > Layer-specific Vulnerability Detection > Application layer > Web-facing vulnerabilities,,taxonomy_figure,TRUE,4
FixFinder_2024,Automated Mapping of Vulnerability Advisories onto their Fix Commits in Open Source Repositories,FixFinder,2024,ACM Trans. Softw. Eng. Methodol.,study,VM.VD,VM.VD.LSVD.SYS,1,1,1,1,1,5,,Dynamic analysis,System,,title-only,title,Automated Mapping of Vulnerability Advisories onto their Fix Commits in Open Source Repositories,title:61-67,commit,,,1,title-only,TRUE,TRUE,TRUE,TRUE,FALSE,TRUE,Fix Identification,Patch Finding,,,,Fix Identification > Patch Finding,,taxonomy_figure,TRUE,4
PatchFinder_2024,PatchFinder: A Two-Phase Approach to Security Patch Tracing for Disclosed Vulnerabilities in Open-Source Software,PatchFinder,2024,Proceedings of the 33rd ACM SIGSOFT International Symposium on Software Testing and Analysis,method/tool,VM.VD,VM.VD.LSVD.SYS,1,1,0,1,1,4,,,System,,title-only,title,PatchFinder: A Two-Phase Approach to Security Patch Tracing for Disclosed Vulnerabilities in Open-Source Software,title:0-5,patch,,,1,title-only,TRUE,TRUE,TRUE,TRUE,FALSE,TRUE,Fix Identification,Patch Finding,,,,Fix Identification > Patch Finding,,taxonomy_figure,TRUE,4
VF_Detector_2024,VF-Detector: making multi-granularity code changes on vulnerability fix detector robust to mislabeled changes,VF-Detector,2024,Proceedings of the Thirty-Third International Joint Conference on Artificial Intelligence,study,VM.VD,VM.VD.GVD,1,1,1,1,1,5,,,,,title-only,title,VF-Detector: making multi-granularity code changes on vulnerability fix detector robust to mislabeled changes,,,,,1,title-only,TRUE,TRUE,TRUE,TRUE,FALSE,TRUE,Fix Identification,Multi-granularity identification,,,,Fix Identification > Multi-granularity identification,,taxonomy_figure,TRUE,4
VulAdvisor_2024,VulAdvisor: Natural Language Suggestion Generation for Software Vulnerability Repair,VulAdvisor,2024,Proceedings of the 39th IEEE/ACM International Conference on Automated Software Engineering,study,VM.VR,VM.VR,1,0,1,1,1,4,VM.VD,,,,title-only,title,VulAdvisor: Natural Language Suggestion Generation for Software Vulnerability Repair,title:78-84,repair; vulnerability repair,R1,"Multiple stage cues in title: VM.VR, VM.VD; primary chosen by heuristic.",1,title-only,TRUE,TRUE,TRUE,TRUE,FALSE,TRUE,Vulnerability Repair,,,,,Vulnerability Repair,,primary_label_code,TRUE,4
Yuan2024StagedVulBERT,StagedVulBERT: Multigranular Vulnerability Detection With a Novel Pretrained Code Model,StagedVulBERT,2024,IEEE Transactions on Software Engineering,study,VM.VD,VM.VD.GVD.S.LB.SEQ,1,1,0,1,1,4,,Token encoder,,,title-only,title,StagedVulBERT: Multigranular Vulnerability Detection With a Novel Pretrained Code Model,,,,,3,title-only,TRUE,TRUE,TRUE,TRUE,FALSE,TRUE,Vulnerability Detection,General Vulnerability Detection,Static approach,Learning-based,Sequence representation,Vulnerability Detection > General Vulnerability Detection > Static approach > Learning-based > Sequence representation,,taxonomy_figure,TRUE,4
bouom2024triassetrank,"TriAssetRank: Ranking Vulnerabilities, Exploits, and Privileges for Countermeasures Prioritization",TriAssetRank,2024,IEEE Transactions on Information Forensics and Security,study,VM.VA,VM.VA.AP,1,1,1,1,1,5,,,,,title-only,title,"TriAssetRank: Ranking Vulnerabilities, Exploits, and Privileges for Countermeasures Prioritization",title:84-91,priorit; ranking; rank,,,1,title-only,TRUE,TRUE,TRUE,TRUE,FALSE,TRUE,Vulnerability Analysis,Assessment and Prioritization,,,,Vulnerability Analysis > Assessment and Prioritization,,taxonomy_figure,TRUE,4
cao2024coca,Coca: Improving and explaining graph neural network-based vulnerability detection systems,Coca,2024,Proceedings of the IEEE/ACM 46th International Conference on Software Engineering,method/tool,VM.VD,VM.VD.LSVD.NET.IMPL,1,1,1,0,1,4,VM.VA,GNN; Program graphs,Network,,title-only,title,Coca: Improving and explaining graph neural network-based vulnerability detection systems,title:20-27,explain; graph neural,R2,"Multiple stage cues in title: VM.VA, VM.VD; primary chosen by heuristic.",3,title-only,TRUE,TRUE,TRUE,TRUE,FALSE,TRUE,Vulnerability Detection,General Vulnerability Detection,Static approach,Learning-based,Graph representation,Vulnerability Detection > General Vulnerability Detection > Static approach > Learning-based > Graph representation,,taxonomy_figure,TRUE,4
cao2024snopy,Snopy: Bridging sample denoising with causal graph learning for effective vulnerability detection,Snopy,2024,Proceedings of the 39th IEEE/ACM International Conference on Automated Software Engineering,study,VM.VD,VM.VD.GVD.S.LB.GRAPH,0,1,1,1,1,4,,Program graphs,,,title-only,title,Snopy: Bridging sample denoising with causal graph learning for effective vulnerability detection,,,,,2,title-only,TRUE,TRUE,TRUE,TRUE,FALSE,TRUE,Vulnerability Detection,General Vulnerability Detection,Static approach,Learning-based,Graph representation,Vulnerability Detection > General Vulnerability Detection > Static approach > Learning-based > Graph representation,,taxonomy_figure,TRUE,4
chen2024improving,Improving smart contract security with contrastive learning-based vulnerability detection,Clear,2024,Proceedings of the IEEE/ACM 46th International Conference on Software Engineering,study,VM.VD,VM.VD.SC.S,1,1,1,1,1,5,,,Smart contract,,title-only,title,Improving smart contract security with contrastive learning-based vulnerability detection,title:10-24,smart contract,,,2,title-only,TRUE,TRUE,TRUE,TRUE,FALSE,TRUE,Vulnerability Detection,Vulnerability Detection for Smart Contracts,Static approach,,,Vulnerability Detection > Vulnerability Detection for Smart Contracts > Static approach,,taxonomy_figure,TRUE,4
chu2024graph,Graph neural networks for vulnerability detection: A counterfactual explanation,CFExplainer,2024,Proceedings of the 33rd ACM SIGSOFT International Symposium on Software Testing and Analysis,study,VM.VD,VM.VD.LSVD.NET.IMPL,1,0,1,1,1,4,VM.VA,GNN; Program graphs,Network,,title-only,title,Graph neural networks for vulnerability detection: A counterfactual explanation,title:53-67,counterfactual; graph neural,R2,"Multiple stage cues in title: VM.VA, VM.VD; primary chosen by heuristic.",3,title-only,TRUE,TRUE,TRUE,TRUE,FALSE,TRUE,Vulnerability Detection,General Vulnerability Detection,Static approach,Learning-based,Graph representation,Vulnerability Detection > General Vulnerability Detection > Static approach > Learning-based > Graph representation,,taxonomy_figure,TRUE,4
do2024optimizing,Optimizing software vulnerability detection using RoBERTa and machine learning,RoBERTaAGS,2024,Automated Software Engineering,study,VM.VD,VM.VD.GVD.S.LB.SEQ,1,1,0,1,1,4,,Token encoder,,,title-only,title,Optimizing software vulnerability detection using RoBERTa and machine learning,,,,,3,title-only,TRUE,TRUE,TRUE,TRUE,FALSE,TRUE,Vulnerability Detection,General Vulnerability Detection,Static approach,Learning-based,Sequence representation,Vulnerability Detection > General Vulnerability Detection > Static approach > Learning-based > Sequence representation,,taxonomy_figure,TRUE,4
feng2024fire,$\{$FIRE$\}$: Combining $\{$Multi-Stage$\}$ Filtering with Taint Analysis for Scalable Recurring Vulnerability Detection,FIRE,2024,33rd USENIX Security Symposium (USENIX Security 24),study,VM.VD,VM.VD.GVD,1,0,1,1,1,4,,Taint analysis,,,title-only,title,$\{$FIRE$\}$: Combining $\{$Multi-Stage$\}$ Filtering with Taint Analysis for Scalable Recurring Vulnerability Detection,,,,,3,title-only,TRUE,TRUE,TRUE,TRUE,FALSE,TRUE,Vulnerability Detection,Layer-specific Vulnerability Detection,Application layer,Cross-scope and recurring vulnerabilities,,Vulnerability Detection > Layer-specific Vulnerability Detection > Application layer > Cross-scope and recurring vulnerabilities,,taxonomy_figure,TRUE,4
guo2024reactappscan,ReactAppScan: Mining React Application Vulnerabilities via Component Graph,ReactAppScan,2024,Proceedings of the 2024 on ACM SIGSAC Conference on Computer and Communications Security,study,VM.VD,VM.VD.GVD.S.GA,0,1,1,1,1,4,,Program graphs,,,title-only,title,ReactAppScan: Mining React Application Vulnerabilities via Component Graph,,,,,0,title-only,TRUE,TRUE,TRUE,TRUE,FALSE,TRUE,Vulnerability Detection,Layer-specific Vulnerability Detection,Application layer,Ecosystem-specific vulnerabilities,,Vulnerability Detection > Layer-specific Vulnerability Detection > Application layer > Ecosystem-specific vulnerabilities,,taxonomy_figure,TRUE,4
