citekey,title,toolname,year,venue,artifact_type,primary_stage,primary_label,QAC1,QAC2,QAC3,QAC4,QAC5,QAC_total,secondary_labels,technique_tags,layer_tag,vuln_type,coding_basis,evidence_source,evidence_span,evidence_charspan,matched_cue,rule_id,notes,QAC_total_3,qac_basis,needs_manual_qac_review,qc_primary_single,qc_evidence_nonempty,qc_secondary_delimiter_ok,needs_abstract_review,needs_labelset_validation,tax_level1,tax_level2,tax_level3,tax_level4,tax_level5,tax_path_full,tax_alt_paths,tax_source,QAC_pass_total_ge4,QAC_threshold
Amouei_2022_rat,RAT: Reinforcement-Learning-Driven and Adaptive Testing for Vulnerability Discovery in Web Application Firewalls,RAT,2022,IEEE Transactions on Dependable and Secure Computing,study,VM.VD,VM.VD.LSVD.APP.WEB,1,1,1,1,0,4,,,Application,,title-only,title,RAT: Reinforcement-Learning-Driven and Adaptive Testing for Vulnerability Discovery in Web Application Firewalls,,,,,1,title-only,TRUE,TRUE,TRUE,TRUE,FALSE,TRUE,Vulnerability Detection,Layer-specific Vulnerability Detection,Application layer,Web-facing vulnerabilities,,Vulnerability Detection > Layer-specific Vulnerability Detection > Application layer > Web-facing vulnerabilities,,taxonomy_figure,TRUE,4
HERMES_2022,HERMES: Using Commit-Issue Linking to Detect Vulnerability-Fixing Commits,HERMES,2022,"2022 IEEE International Conference on Software Analysis, Evolution and Reengineering (SANER)",study,VM.FI,VM.FI.PF,0,1,1,1,1,4,VM.VD,,,,title-only,title,HERMES: Using Commit-Issue Linking to Detect Vulnerability-Fixing Commits,title:59-72,fixing commit; fixing commits; commit,R1,"Multiple stage cues in title: VM.FI, VM.VD; primary chosen by heuristic.",1,title-only,TRUE,TRUE,TRUE,TRUE,FALSE,TRUE,Fix Identification,Commit-level identification,,,,Fix Identification > Commit-level identification,,taxonomy_figure,TRUE,4
MA2022CASMS,CASMS: Combining clustering with attention semantic model for identifying security bug reports,CASMS,2022,Information and Software Technology,study,VM.SBI,VM.SBI,1,1,1,1,1,5,,,,,title-only,title,CASMS: Combining clustering with attention semantic model for identifying security bug reports,title:83-93,bug report; security bug,,,1,title-only,TRUE,TRUE,TRUE,TRUE,FALSE,TRUE,Security Bug Identification,Learning-based,,,,Security Bug Identification > Learning-based,,taxonomy_figure,TRUE,4
PVR_2022,Program vulnerability repair via inductive inference,VulnFix,2022,Proceedings of the 31st ACM SIGSOFT International Symposium on Software Testing and Analysis,study,VM.VR,VM.VR,1,1,0,1,1,4,VM.VD,,,,title-only,title,Program vulnerability repair via inductive inference,title:22-28,repair; vulnerability repair,R1,"Multiple stage cues in title: VM.VR, VM.VD; primary chosen by heuristic.",1,title-only,TRUE,TRUE,TRUE,TRUE,FALSE,TRUE,Vulnerability Repair,Fuzzing-driven repair,,,,Vulnerability Repair > Fuzzing-driven repair,,taxonomy_figure,TRUE,4
RegexReDoS_2022,Repairing DoS Vulnerability of Real-World Regexes,REMEDY,2022,,study,VM.VR,VM.VR,1,1,1,1,1,5,VM.VD,,Network,DoS,title-only,title,Repairing DoS Vulnerability of Real-World Regexes,title:0-6,repair,R1,"Multiple stage cues in title: VM.VR, VM.VD; primary chosen by heuristic.",1,title-only,TRUE,TRUE,TRUE,TRUE,FALSE,TRUE,Vulnerability Repair,Constraint-guided repair,,,,Vulnerability Repair > Constraint-guided repair,,taxonomy_figure,TRUE,4
Tracer_2022,Tracking patches for open source software vulnerabilities,Tracer,2022,Proceedings of the 30th ACM Joint European Software Engineering Conference and Symposium on the Foundations of Software Engineering,study,unclear,unclear,1,1,1,1,1,5,,,,,title-only,title,Tracking patches for open source software vulnerabilities,title:9-14,patch,R3,Title-only evidence insufficient for stage; keep as unclear.,1,title-only,TRUE,TRUE,TRUE,TRUE,TRUE,TRUE,Fix Identification,Patch Finding,,,,Fix Identification > Patch Finding,,taxonomy_figure,TRUE,4
VulCurator_2022,VulCurator: a vulnerability-fixing commit detector,VulCurator,2022,Proceedings of the 30th ACM Joint European Software Engineering Conference and Symposium on the Foundations of Software Engineering,study,VM.FI,VM.FI.PF,0,1,1,1,1,4,VM.VD,,,,title-only,title,VulCurator: a vulnerability-fixing commit detector,title:28-41,fixing commit; commit,R1,"Multiple stage cues in title: VM.FI, VM.VD; primary chosen by heuristic.",1,title-only,TRUE,TRUE,TRUE,TRUE,FALSE,TRUE,Fix Identification,Commit-level identification,,,,Fix Identification > Commit-level identification,,taxonomy_figure,TRUE,4
VulFixMiner_2022,Finding a needle in a haystack: automated mining of silent vulnerability fixes,VulFixMiner,2022,Proceedings of the 36th IEEE/ACM International Conference on Automated Software Engineering,study,VM.VD,VM.VD.LSVD.NET.IMPL,1,1,1,1,1,5,,,Network,,title-only,title,Finding a needle in a haystack: automated mining of silent vulnerability fixes,,,,,1,title-only,TRUE,TRUE,TRUE,TRUE,FALSE,TRUE,Fix Identification,Silent fix identification,,,,Fix Identification > Silent fix identification,,taxonomy_figure,TRUE,4
Wu2022Data,Data Quality Matters: A Case Study on Data Label Correctness for Security Bug Report Prediction,CBSBR,2022,IEEE Transactions on Software Engineering,study,VM.SBI,VM.SBI,0,1,1,1,1,4,VM.VD,,,,title-only,title,Data Quality Matters: A Case Study on Data Label Correctness for Security Bug Report Prediction,title:74-84,bug report; security bug,R1,"Multiple stage cues in title: VM.SBI, VM.VD; primary chosen by heuristic.",1,title-only,TRUE,TRUE,TRUE,TRUE,FALSE,TRUE,Security Bug Identification,,,,,Security Bug Identification,,primary_label_code,TRUE,4
cao2022mvd,MVD: memory-related vulnerability detection based on flow-sensitive graph neural networks,MVD,2022,Proceedings of the 44th international conference on software engineering,study,VM.VD,VM.VD.LSVD.NET.IMPL,1,1,1,1,0,4,,GNN; Program graphs,Network,,title-only,title,MVD: memory-related vulnerability detection based on flow-sensitive graph neural networks,title:68-80,graph neural,,,3,title-only,TRUE,TRUE,TRUE,TRUE,FALSE,TRUE,Vulnerability Detection,Layer-specific Vulnerability Detection,Application layer,Memory-related vulnerabilities,,Vulnerability Detection > Layer-specific Vulnerability Detection > Application layer > Memory-related vulnerabilities,,taxonomy_figure,TRUE,4
chen2022wasai,Wasai: uncovering vulnerabilities in wasm smart contracts,WASAI,2022,Proceedings of the 31st ACM SIGSOFT International Symposium on Software Testing and Analysis,study,unclear,unclear,1,0,1,1,1,4,,,Smart contract,,title-only,title,Wasai: uncovering vulnerabilities in wasm smart contracts,title:42-56,smart contract,R3,Title-only evidence insufficient for stage; keep as unclear.,0,title-only,TRUE,TRUE,TRUE,TRUE,TRUE,TRUE,Vulnerability Detection,Vulnerability Detection for Smart Contracts,Dynamic approach,,,Vulnerability Detection > Vulnerability Detection for Smart Contracts > Dynamic approach,,taxonomy_figure,TRUE,4
cheng2022path,Path-sensitive code embedding via contrastive learning for software vulnerability detection,ContraFlow,2022,Proceedings of the 31st ACM SIGSOFT international symposium on software testing and analysis,study,VM.VD,VM.VD.GVD.S.LB.SEQ,1,1,1,1,0,4,,Token encoder,,,title-only,title,Path-sensitive code embedding via contrastive learning for software vulnerability detection,,,,,2,title-only,TRUE,TRUE,TRUE,TRUE,FALSE,TRUE,Vulnerability Detection,General Vulnerability Detection,Static approach,Learning-based,Graph-to-sequence representation,Vulnerability Detection > General Vulnerability Detection > Static approach > Learning-based > Graph-to-sequence representation,,taxonomy_figure,TRUE,4
cui2022vrust,VRust: Automated vulnerability detection for solana smart contracts,VRust,2022,Proceedings of the 2022 ACM SIGSAC Conference on Computer and Communications Security,study,VM.VD,VM.VD.SC.S,1,1,1,1,1,5,,,Smart contract,,title-only,title,VRust: Automated vulnerability detection for solana smart contracts,title:52-66,smart contract,,,1,title-only,TRUE,TRUE,TRUE,TRUE,FALSE,TRUE,Vulnerability Detection,Vulnerability Detection for Smart Contracts,Static approach,,,Vulnerability Detection > Vulnerability Detection for Smart Contracts > Static approach,,taxonomy_figure,TRUE,4
ferrerira2022elysium,Elysium: Context-Aware Bytecode-Level Patching to Automatically Heal Vulnerable Smart Contracts,Elysium,2022,"Proceedings of the 25th International Symposium on Research in Attacks, Intrusions and Defenses",study,VM.VR,VM.VR.SCR,1,1,1,1,0,4,,,Smart contract,,title-only,title,Elysium: Context-Aware Bytecode-Level Patching to Automatically Heal Vulnerable Smart Contracts,title:38-46,patching; smart contract; patch,,,1,title-only,TRUE,TRUE,TRUE,TRUE,FALSE,TRUE,Vulnerability Repair,Smart contract repair,,,,Vulnerability Repair > Smart contract repair,,taxonomy_figure,TRUE,4
fu2022linevul,Linevul: A transformer-based line-level vulnerability prediction,LineVul,2022,Proceedings of the 19th International Conference on Mining Software Repositories,study,VM.VD,VM.VD.GVD.S.LB.SEQ,1,0,1,1,1,4,,Token encoder,,,title-only,title,Linevul: A transformer-based line-level vulnerability prediction,,,,,2,title-only,TRUE,TRUE,TRUE,TRUE,FALSE,TRUE,Vulnerability Detection,General Vulnerability Detection,Static approach,Learning-based,Sequence representation,Vulnerability Detection > General Vulnerability Detection > Static approach > Learning-based > Sequence representation,,taxonomy_figure,TRUE,4
garg2022learning,Learning from what we know: How to perform vulnerability prediction using noisy historical data,TROVON,2022,Empirical Software Engineering,study,VM.VD,VM.VD.GVD,1,0,1,1,1,4,,,,,title-only,title,Learning from what we know: How to perform vulnerability prediction using noisy historical data,,,,,1,title-only,TRUE,TRUE,TRUE,TRUE,FALSE,TRUE,Vulnerability Detection,General Vulnerability Detection,Static approach,Learning-based,Sequence representation,Vulnerability Detection > General Vulnerability Detection > Static approach > Learning-based > Sequence representation,,taxonomy_figure,TRUE,4
ghaleb2022etainter,eTainter: detecting gas-related vulnerabilities in smart contracts,eTainter,2022,Proceedings of the 31st ACM SIGSOFT International Symposium on Software Testing and Analysis,study,VM.VD,VM.VD.SC.S,1,1,1,0,1,4,,Taint analysis,Smart contract,,title-only,title,eTainter: detecting gas-related vulnerabilities in smart contracts,title:51-65,smart contract,,,3,title-only,TRUE,TRUE,TRUE,TRUE,FALSE,TRUE,Vulnerability Detection,Vulnerability Detection for Smart Contracts,Specific vulnerability types,,,Vulnerability Detection > Vulnerability Detection for Smart Contracts > Specific vulnerability types,,taxonomy_figure,TRUE,4
gu2022comrace,$\{$COMRace$\}$: detecting data race vulnerabilities in $\{$COM$\}$ objects,COMRACE,2022,31st USENIX Security Symposium (USENIX Security 22),study,VM.VD,VM.VD.GVD,1,1,0,1,1,4,,,,Race condition,title-only,title,$\{$COMRace$\}$: detecting data race vulnerabilities in $\{$COM$\}$ objects,,,,,1,title-only,TRUE,TRUE,TRUE,TRUE,FALSE,TRUE,Vulnerability Detection,Layer-specific Vulnerability Detection,Middleware layer,Third-party components,,Vulnerability Detection > Layer-specific Vulnerability Detection > Middleware layer > Third-party components,,taxonomy_figure,TRUE,4
guo2022detecting,Detecting and augmenting missing key aspects in vulnerability descriptions,Guo et al.; CVEL,2022,ACM Transactions on Software Engineering and Methodology (TOSEM),study,VM.VD,VM.VD.GVD,1,1,1,1,0,4,,,,,title-only,title,Detecting and augmenting missing key aspects in vulnerability descriptions,,,,,1,title-only,TRUE,TRUE,TRUE,TRUE,FALSE,TRUE,Vulnerability Analysis,Artifact Analysis,,,,Vulnerability Analysis > Artifact Analysis,,taxonomy_figure,TRUE,4
hin2022linevd,Linevd: Statement-level vulnerability detection using graph neural networks,LineVD,2022,Proceedings of the 19th international conference on mining software repositories,study,VM.VD,VM.VD.LSVD.NET.IMPL,1,0,1,1,1,4,,GNN; Program graphs,Network,,title-only,title,Linevd: Statement-level vulnerability detection using graph neural networks,title:54-66,graph neural,,,3,title-only,TRUE,TRUE,TRUE,TRUE,FALSE,TRUE,Vulnerability Detection,General Vulnerability Detection,Static approach,Learning-based,Graph representation,Vulnerability Detection > General Vulnerability Detection > Static approach > Learning-based > Graph representation,,taxonomy_figure,TRUE,4
kang2022probe,Probe the Proto: Measuring Client-Side Prototype Pollution Vulnerabilities of One Million Real-world Websites,PROBETHEPROTO,2022,Proceedings of the Network and Distributed System Security Symposium (NDSS),study,unclear,unclear,1,1,1,1,1,5,,,Application,,title-only,title,Probe the Proto: Measuring Client-Side Prototype Pollution Vulnerabilities of One Million Real-world Websites,,,R3,Title-only evidence insufficient for stage; keep as unclear.,0,title-only,TRUE,TRUE,TRUE,TRUE,TRUE,TRUE,Vulnerability Detection,Layer-specific Vulnerability Detection,Application layer,Web-facing vulnerabilities,,Vulnerability Detection > Layer-specific Vulnerability Detection > Application layer > Web-facing vulnerabilities,,taxonomy_figure,TRUE,4
kang2022tracer,Tracer: Signature-based static analysis for detecting recurring vulnerabilities,TRACER,2022,Proceedings of the 2022 ACM SIGSAC Conference on Computer and Communications Security,study,VM.VD,VM.VD.GVD.D,1,1,1,1,0,4,VM.VA,Dynamic analysis; Static analysis,,Race condition,title-only,title,Tracer: Signature-based static analysis for detecting recurring vulnerabilities,,,R2,"Multiple stage cues in title: VM.VA, VM.VD; primary chosen by heuristic.",2,title-only,TRUE,TRUE,TRUE,TRUE,FALSE,TRUE,Vulnerability Detection,Layer-specific Vulnerability Detection,Application layer,Cross-scope and recurring vulnerabilities,,Vulnerability Detection > Layer-specific Vulnerability Detection > Application layer > Cross-scope and recurring vulnerabilities,,taxonomy_figure,TRUE,4
kim2022fuzzorigin,$\{$FuzzOrigin$\}$: Detecting $\{$UXSS$\}$ vulnerabilities in browsers through origin fuzzing,FUZZORIGIN,2022,31st usenix security symposium (usenix security 22),study,VM.VD,VM.VD.LSVD.APP.XSS,1,1,1,1,0,4,,Fuzzing,Application,XSS,title-only,title,$\{$FuzzOrigin$\}$: Detecting $\{$UXSS$\}$ vulnerabilities in browsers through origin fuzzing,title:4-8,fuzz; fuzzing,,,3,title-only,TRUE,TRUE,TRUE,TRUE,FALSE,TRUE,Vulnerability Detection,Layer-specific Vulnerability Detection,Application layer,XSS vulnerabilities,,Vulnerability Detection > Layer-specific Vulnerability Detection > Application layer > XSS vulnerabilities,Vulnerability Detection > Layer-specific Vulnerability Detection > Application layer > Web-facing vulnerabilities,taxonomy_figure,TRUE,4
krupp2022ampfuzz,$\{$AmpFuzz$\}$: Fuzzing for amplification $\{$DDoS$\}$ vulnerabilities,AMPFUZZ,2022,31st USENIX Security Symposium (USENIX Security 22),study,unclear,unclear,1,1,1,1,1,5,,Fuzzing,Network,DoS,title-only,title,$\{$AmpFuzz$\}$: Fuzzing for amplification $\{$DDoS$\}$ vulnerabilities,title:7-11,fuzz; fuzzing,R3,Title-only evidence insufficient for stage; keep as unclear.,3,title-only,TRUE,TRUE,TRUE,TRUE,TRUE,TRUE,Vulnerability Detection,Layer-specific Vulnerability Detection,Network layer,DoS vulnerabilities,,Vulnerability Detection > Layer-specific Vulnerability Detection > Network layer > DoS vulnerabilities,,taxonomy_figure,TRUE,4
lee2022link,Link: Black-box detection of cross-site scripting vulnerabilities using reinforcement learning,Link,2022,Proceedings of the ACM Web Conference 2022,study,VM.VD,VM.VD.LSVD.SYS,1,1,1,1,1,5,,,System,,title-only,title,Link: Black-box detection of cross-site scripting vulnerabilities using reinforcement learning,,,,,2,title-only,TRUE,TRUE,TRUE,TRUE,FALSE,TRUE,Vulnerability Detection,Layer-specific Vulnerability Detection,Application layer,XSS vulnerabilities,,Vulnerability Detection > Layer-specific Vulnerability Detection > Application layer > XSS vulnerabilities,Vulnerability Detection > Layer-specific Vulnerability Detection > Application layer > Web-facing vulnerabilities,taxonomy_figure,TRUE,4
lefeuvre2022assessing,Assessing the impact of interface vulnerabilities in compartmentalized software,ConfFuzz,2022,arXiv preprint arXiv:2212.12904,study,unclear,unclear,1,0,1,1,1,4,,,,,title-only,title,Assessing the impact of interface vulnerabilities in compartmentalized software,,,R3,Title-only evidence insufficient for stage; keep as unclear.,0,title-only,TRUE,TRUE,TRUE,TRUE,TRUE,TRUE,Vulnerability Detection,General Vulnerability Detection,Dynamic approach,Fuzzing,,Vulnerability Detection > General Vulnerability Detection > Dynamic approach > Fuzzing,,taxonomy_figure,TRUE,4
li2022mining,Mining node. js vulnerabilities via object dependence graph and query,ODGEN,2022,31st USENIX Security Symposium (USENIX Security 22),study,unclear,unclear,1,1,1,1,1,5,,Program graphs,,,title-only,title,Mining node. js vulnerabilities via object dependence graph and query,,,R3,Title-only evidence insufficient for stage; keep as unclear.,0,title-only,TRUE,TRUE,TRUE,TRUE,TRUE,TRUE,Vulnerability Detection,Layer-specific Vulnerability Detection,Application layer,Ecosystem-specific vulnerabilities,,Vulnerability Detection > Layer-specific Vulnerability Detection > Application layer > Ecosystem-specific vulnerabilities,,taxonomy_figure,TRUE,4
liao2022smartdagger,SmartDagger: a bytecode-based static analysis approach for detecting cross-contract vulnerability,SmartDagger,2022,Proceedings of the 31st ACM SIGSOFT International Symposium on Software Testing and Analysis,method/tool,VM.VD,VM.VD.LSVD.SYS,1,1,1,1,1,5,,Static analysis,System,,title-only,title,SmartDagger: a bytecode-based static analysis approach for detecting cross-contract vulnerability,,,,,2,title-only,TRUE,TRUE,TRUE,TRUE,FALSE,TRUE,Vulnerability Detection,Vulnerability Detection for Smart Contracts,Specific vulnerability types,,,Vulnerability Detection > Vulnerability Detection for Smart Contracts > Specific vulnerability types,,taxonomy_figure,TRUE,4
lu2022detecting,Detecting missing-permission-check vulnerabilities in distributed cloud systems,MPChecker,2022,Proceedings of the 2022 ACM SIGSAC Conference on Computer and Communications Security,method/tool,VM.VD,VM.VD.LSVD.MW.DIST,1,1,1,1,0,4,,,Middleware,,title-only,title,Detecting missing-permission-check vulnerabilities in distributed cloud systems,,,,,1,title-only,TRUE,TRUE,TRUE,TRUE,FALSE,TRUE,Vulnerability Detection,Layer-specific Vulnerability Detection,Middleware layer,Distributed systems,,Vulnerability Detection > Layer-specific Vulnerability Detection > Middleware layer > Distributed systems,,taxonomy_figure,TRUE,4
luo2022tchecker,Tchecker: Precise static inter-procedural analysis for detecting taint-style vulnerabilities in php applications,TChecker,2022,Proceedings of the 2022 ACM SIGSAC Conference on Computer and Communications Security,study,VM.VD,VM.VD.GVD,1,1,1,1,1,5,,Static analysis; Taint analysis,,,title-only,title,Tchecker: Precise static inter-procedural analysis for detecting taint-style vulnerabilities in php applications,,,,,3,title-only,TRUE,TRUE,TRUE,TRUE,FALSE,TRUE,Vulnerability Detection,Layer-specific Vulnerability Detection,Application layer,Ecosystem-specific vulnerabilities,,Vulnerability Detection > Layer-specific Vulnerability Detection > Application layer > Ecosystem-specific vulnerabilities,,taxonomy_figure,TRUE,4
park2022fugio,$\{$FUGIO$\}$: Automatic exploit generation for $\{$PHP$\}$ object injection vulnerabilities,FUGIO,2022,31st USENIX Security Symposium (USENIX Security 22),dataset/benchmark,,,1,0,1,1,1,4,,,,,resource,title,$\{$FUGIO$\}$: Automatic exploit generation for $\{$PHP$\}$ object injection vulnerabilities,,,,Dataset/benchmark resource; excluded from VM-stage assignment in taxonomy coding.,4,title-only,TRUE,TRUE,TRUE,TRUE,FALSE,FALSE,Vulnerability Detection,Layer-specific Vulnerability Detection,Application layer,Ecosystem-specific vulnerabilities,,Vulnerability Detection > Layer-specific Vulnerability Detection > Application layer > Ecosystem-specific vulnerabilities,,taxonomy_figure,TRUE,4
rahat2022cerberus,Cerberus: Query-driven scalable vulnerability detection in oauth service provider implementations,Cerberus,2022,Proceedings of the 2022 ACM SIGSAC Conference on Computer and Communications Security,study,VM.VD,VM.VD.GVD,1,1,1,1,0,4,,,,,title-only,title,Cerberus: Query-driven scalable vulnerability detection in oauth service provider implementations,,,,,1,title-only,TRUE,TRUE,TRUE,TRUE,FALSE,TRUE,Vulnerability Detection,Layer-specific Vulnerability Detection,Application layer,API and logic vulnerabilities,,Vulnerability Detection > Layer-specific Vulnerability Detection > Application layer > API and logic vulnerabilities,,taxonomy_figure,TRUE,4
sawadogo2022sspcatcher,SSPCatcher: Learning to catch security patches,SSPCATCHER,2022,Empirical Software Engineering,study,unclear,unclear,1,0,1,1,1,4,,,,,title-only,title,SSPCatcher: Learning to catch security patches,title:39-44,patch,R3,Title-only evidence insufficient for stage; keep as unclear.,2,title-only,TRUE,TRUE,TRUE,TRUE,TRUE,TRUE,Fix Identification,Silent fix identification,,,,Fix Identification > Silent fix identification,,taxonomy_figure,TRUE,4
sun2022heterogeneous,Heterogeneous vulnerability report traceability recovery by vulnerability aspect matching,Sun et al.; multi-source attribute corpus,2022,2022 IEEE International Conference on Software Maintenance and Evolution (ICSME),study,VM.VD,VM.VD.GVD.D,1,1,1,0,1,4,VM.VA,Dynamic analysis,,Race condition,title-only,title,Heterogeneous vulnerability report traceability recovery by vulnerability aspect matching,,,R2,"Multiple stage cues in title: VM.VA, VM.VD; primary chosen by heuristic.",0,title-only,TRUE,TRUE,TRUE,TRUE,FALSE,TRUE,Vulnerability Analysis,Artifact Analysis,,,,Vulnerability Analysis > Artifact Analysis,,taxonomy_figure,TRUE,4
turovnova2022counting,Counting in Regexes Considered Harmful: Exposing $\{$ReDoS$\}$ Vulnerability of Nonbacktracking Matchers,Turovnova et al.,2022,31st USENIX Security Symposium (USENIX Security 22),study,VM.VD,VM.VD.LSVD.NET.REDOS,1,1,1,1,1,5,,,Network,ReDoS,title-only,title,Counting in Regexes Considered Harmful: Exposing $\{$ReDoS$\}$ Vulnerability of Nonbacktracking Matchers,,,,,0,title-only,TRUE,TRUE,TRUE,TRUE,FALSE,TRUE,Vulnerability Detection,Layer-specific Vulnerability Detection,Network layer,ReDoS vulnerabilities,,Vulnerability Detection > Layer-specific Vulnerability Detection > Network layer > ReDoS vulnerabilities,,taxonomy_figure,TRUE,4
vadayath2022arbiter,Arbiter: Bridging the static and dynamic divide in vulnerability discovery on binary programs,ARBITER,2022,31st USENIX Security Symposium (USENIX Security 22),study,VM.VD,VM.VD.LSVD.SYS.BIN,1,1,1,1,1,5,,Dynamic analysis; Static analysis,System,,title-only,title,Arbiter: Bridging the static and dynamic divide in vulnerability discovery on binary programs,,,,,0,title-only,TRUE,TRUE,TRUE,TRUE,FALSE,TRUE,Vulnerability Detection,Layer-specific Vulnerability Detection,System layer,Binary code & compiler vulnerabilities,,Vulnerability Detection > Layer-specific Vulnerability Detection > System layer > Binary code & compiler vulnerabilities,Vulnerability Detection > Layer-specific Vulnerability Detection > Application layer > Cross-scope and recurring vulnerabilities,taxonomy_figure,TRUE,4
wan2022too,Too afraid to drive: systematic discovery of semantic dos vulnerability in autonomous driving planning under physical-world attacks,PlanFuzz,2022,arXiv preprint arXiv:2201.04610,method/tool,VM.VD,VM.VD.LSVD.NET.DOS,1,1,1,0,1,4,,,Network,DoS,title-only,title,Too afraid to drive: systematic discovery of semantic dos vulnerability in autonomous driving planning under physical-world attacks,,,,,0,title-only,TRUE,TRUE,TRUE,TRUE,FALSE,TRUE,Vulnerability Detection,Layer-specific Vulnerability Detection,Network layer,Algorithmic complexity & semantic DoS,,Vulnerability Detection > Layer-specific Vulnerability Detection > Network layer > Algorithmic complexity & semantic DoS,,taxonomy_figure,TRUE,4
wang2022auto,Automatic Classification of Bug Reports Based on Multiple Text Information and Reports' Intention,IAC,2022,Theoretical Aspects of Software Engineering,study,VM.SBI,VM.SBI,0,1,1,1,1,4,,,,,title-only,title,Automatic Classification of Bug Reports Based on Multiple Text Information and Reports' Intention,title:28-38,bug report,,,0,title-only,TRUE,TRUE,TRUE,TRUE,FALSE,TRUE,Security Bug Identification,Learning-based,,,,Security Bug Identification > Learning-based,,taxonomy_figure,TRUE,4
wang2022vcmatch,Vcmatch: a ranking-based approach for automatic security patches localization for OSS vulnerabilities,VCMATCH; VCMatch,2022,"2022 IEEE International Conference on Software Analysis, Evolution and Reengineering (SANER)",method/tool,VM.VA,VM.VA.AP,0,1,1,1,1,4,,,System,,title-only,title,Vcmatch: a ranking-based approach for automatic security patches localization for OSS vulnerabilities,title:11-18,ranking; rank; patch,,,1,title-only,TRUE,TRUE,TRUE,TRUE,FALSE,TRUE,Fix Identification,Patch Finding,,,,Fix Identification > Patch Finding,,taxonomy_figure,TRUE,4
wu2022aware,$\{$OS-Aware$\}$ vulnerability prioritization via differential severity analysis,DIFFCVSS; DIFFCVSS datasets,2022,31st USENIX Security Symposium (USENIX Security 22),study,VM.VD,VM.VD.LSVD.SYS,1,1,1,1,1,5,VM.VA,,System,,title-only,title,$\{$OS-Aware$\}$ vulnerability prioritization via differential severity analysis,title:31-38,priorit; severity,R2,"Multiple stage cues in title: VM.VA, VM.VD; primary chosen by heuristic.",1,title-only,TRUE,TRUE,TRUE,TRUE,FALSE,TRUE,Vulnerability Analysis,Assessment and Prioritization,,,,Vulnerability Analysis > Assessment and Prioritization,,taxonomy_figure,TRUE,4
